सूचना मिलने के बाद पुलिस सक्रिय हो गई।,1
जिले में परीक्षा संपन्न कराने के लिए 9 केन्द्र बनाए गए थे।,1
बढ़ती लागत के असर की आंशिक तौर पर भरपाई करने के लिए यह बढ़ोतरी की जाएगी.,1
भारत में इंटरनेट का इस्तेमाल बहुत तेजी से बढ़ रहा है,1
बिचली जातियों के नव- सामंतों की दलित-घृणा और फासीवादी रुझान भभक कर सामने आ रहा है .समाजवाद के नाम पर,0
खिलाड़ियों को ज्यादा प्रतियोगिताएं खेलने को नहीं मिल रही है।,0
पाकिस्तान में 9 महीने के बच्चे पर लगा हत्या का आरोप,0
हमें LOC जा कर अपना लिंग निकालकर मुत देना चाहिए पाक पर वरना वो दिन दूर नहीं जब गधे के लिंग से ये पाकिस्तानी हमारे माथे पर चोदु लिख देंगे,0
वन्य प्राणियों को मारना कानूनन जुर्म है,0
इस बढ़ोतरी में भारत और ब्राजील के यूजर्स का अहम योगदान रहा।,1
$RT @PatrikaUP: EXCLUSIVE: मेरठ में आर्मी भर्ती से पहले झाड़ियों में पड़ी मिली कई सीरिंज,1
#BJP की संवैधानिक तिकड़म-संविधान की धारा का गलत हवाला देकर सीक्रेट बैलट (जो होता ही नहीं) से दिल्ली में सरकार बनाने की अलोकतांत्रिक साजिश।,0
एक साधु वेशधारी ने टैक्सी चालक को नशीला प्रसाद खिलाकर तीन हजार रुपये लूट लिए।,0
पुलिस लाचार बनकर तमाशा देख रही है और कुछ असामाजिक तत्व इसका फायदा भी उठाते हैं।,0
इस कारण इस मार्गों को परिवर्तित किय गया है।,1
ख़ुदा ग़रीबनवाज़ है,1
अपनी तकनीकी टीम की मदद से निर्देशक ने फिल्म के परिवेश को रियल रखा है,1
$तू चल तेरे वजूद की समय को भी तलाश है । संस्था का विश्वास ।,1
दोनों टीमों में कई स्टार देसी विदेशी खिलाडियों की मौजूदगी इस मैच के रोमांचक होने की गारंटी है।,1
नाम वापसी की अंतिम तिथि नियत की गई है।,0
तापमान में आ रही गिरावट का असर जनजीवन पर दिख रहा है.,0
उसकी हालत नाजुक है।,0
"जो आपको कभी गुदगुदाएगी, ठहाके लगवायेगी और कहीं-कहीं आपको भावुक भी कर देगी",1
"लेकिन अगर आप थोड़ी सावधानी बरतें, तो मोबाइल फोन में मौजूद कॉन्टैक्ट्स के गुम हो जाने के बाद भी दुखी होने से बच सकते हैं।",1
text,label
ुंदेलखंड के किसानों को अबकी बार बड़ी उम्मीदें थीं.,0
न्होंने कहा कि चूंकि पूंजी की जरूरत बहुत बड़ी है और सरकार को बैंकों के लिए इतनी पूंजी का प्रबंध करना कठिन होगा।,0
श्चिम बंगाल में शासन द्वारा ऐसी शिकायतें लगातार आने पर चिटफंड कंपनियों के ऊपर प्रतिबंध लगाना पड़ा है।,0
हर में नेटवर्किंग कारोबार का मकड़जाल लगातार फैलता जा रहा है।,0
में नहीं लगता कि आने वाले दिनों में कीमतों में परिवर्तन होगा।,0
ौसम में लगातार परिवर्तन और नलों से आ रहे गंदा पानी ने लोगों की सेहत पर हमला बोल दिया है।,0
ुशाल का मेडिकल इश्यू के कारण कुशाल को ये शो छोड़ना पड़ा.,0
क गोल होने के बाद स्काटलैंड ने भारतीय गोल पर दनादन हमले बोले।,0
न्हें धरना देना पड़ा।,0
न्होंने जेपी चौक पर अनिश्चतकालीन धरना आंदोलन शुरू कर दिया है।,0
स बात पर लक्ष्मीनगर की 80 महिलाओं ने शराब भट्टी की दुकान के आगे धरना देना शुरू कर दिया।,0
स कारण से किसानों को उनका माल खुले में ही उतारना पड़ रहा है।,0
ंगाल को लगातार तीसरी हार का सामना करना पडा और उसे अभी अपना खाता खोलना है।,0
ुलिस के लिए सुबूत तलाशना मुश्किल  है।,0
म्मीदवारों ने हत्या के प्रयास के मुकदमों का शपथ पत्र भरा है।,0
रिजनों की तहरीर पर पुलिस ने चार नामजद आरोपियों के खिलाफ हत्या का मामला दर्ज किया।,0
ीलिया संदिग्ध मरीज के खून की जांच में भी वक्त लग रहा है।,0
ह उस आदमी का कत्ल कर देती है।,0
न्होंने शिवांग का कत्ल कर उसके परिजनों से पैसे वसूलने की साजिश रच डाली।,0
स दौरान रास्ते में घात लगाए बदमाशों ने उनके पीछे से गोली मार दी और ज्वैलरी व कैश लूट ले गए.,0
ब पूरी दुनिया जान गई है कि मोदी झूठों के बादशाह हैं और हिटलर के प्रचार मंत्री गोयबल्स के नए अवतार है।,0
गर पंचायत परिसर में जमकर हंगामा हुआ था।,0
ोनों कर्मचारियों पर शराब के नशे में धुत होकर हंगामा करने का आरोप है।,0
्वेता की मां अलका मिश्रा को गंभीर चोट आई है।,0
डकरी ने झारखंड के क्षेत्रीय दलों पर प्रहार किया।,0
ाजपा सिर्फ सत्ता की भूखी है।,0
ोमवार की रात्रि डीजल चोरों की ताक में कुछ साहसी युवक लोडिंग प्वाइंट के समीप घात लगाकर बैठे थे।,0
हां भाषण के दौरान लालू ने जब लोगों को डी एरिया में बुलाया तो पुलिस परेशान हो गई।.,0
ब बदमाशों के हौसले इतने बुलंद हो गए हैं कि वह बेहोश कर लूटपाट कर रहे हैं।,0
ह के खिलाफ जुआ एक्ट में कार्रवाई की गई।,0
कड़े गए युवकों का जुआ अधिनियिम में चालान कर दिया गया है।,0
ेरे लिए सिंगर बनने की लड़ाई बहुत कड़ी थी।,0
खिरी दौर की लड़ाई में नेताओं की जुबान भी बदल गई है।,0
पल और सैमसंग के बीच पेटेंट के उल्लंघन की क़ानूनी लड़ाई चल रही है.,0
रियापुर में दंपती की अज्ञात बीमारी से मौत के बाद उनके तीन बच्चों भी इस रोग से ग्रस्त होकर जिंदगी के लिए संघर्ष कर रहे हैं।,0
स साल आइपीएल में सर्वश्रेष्ठ बल्लेबाजों के बल्लों पर मानो जंग लग गई हो।,0
िछले साल रायपुर की धागा फैक्ट्री व रनियां की एक फैक्ट्री में आग लगने पर तीन श्रमिकों की जलकर मौत हुई थी।,0
ोगों को अपनी नौकरियों से हाथ धोना पड़ा।,0
ांग की कमी का सामना कर रहे भारतीय ऑटो उद्योग में पूरी वैल्यू चैन के भीतर 1.50 लाख लोगों को नौकरी से हाथ धोना पड़ा है।,0
न्होंने जेपी चौक पर अनिश्चतकालीन धरना आंदोलन शुरू कर दिया है।,0
ाजार की सुरक्षा को पुख्ता करने की मांग को लेकर मंगलवार को दुकाने बंद कर व्यापारियों ने अनिश्चित कालीन धरना शुरू कर दिया है।,0
िस्तर से उठना मानो उनके लिए बड़ी सजा के समान होता है।,0
ादसे का कारण ट्रांसफार्मर से चिंगारी उठना बताया जा रहा है।,0
लमान खान की मुश्किलें बढ़ती नजर आ रही हैं.,0
हरों में धुएं और वायु प्रदूषण के कारण अस्थमा रोगियों की संख्या बढ़ती जा रही है।,0
हर में बढ़ती लूट की घटनाओं को लेकर सोमवार को गृहमंत्री बाबूलाल गौर ने कड़ी नाराजगी जताई।,0
िछले कुछ सालों में बच्चों में अस्थमा जैसे गंभीर बीमारी की शिकायत तेजी से बढ़ती जा रही है।,0
स तरह कंपनी के घाटे में बढ़ोतरी हुई है।,0
ीड़ित ने किसी तरह बंधनमुक्त हो कर कंट्रोल रूम को सूचना दी।,0
ेढ़ साल पहले चिह्नित की गई अतिक्रमण वाली जमीन को नगर परिषद मुक्त नहीं करा पाई।,0
ार्सिलोना के कप्तान जावी ने भी अब इस बात को मान लिया है कि उनकी टीम का छह साल में पांचवीं बार ला लीगा खिताब जीतना असंभव है।,0
शुओं के प्रवेश पर रोक लगाना मुश्किल होता है।,0
ाल ही में दो एक्ट्रेस के बीच बात इतनी बढ़ गई कि थप्पड़ तक जड़ दिया।,0
लमान अपनी टोयोटा लैंड क्रूजर ड्राइव कर रहे थे और काफी नशे की हालत में थे।,0
्रॉपर्टी मार्केट की हालत बहुत खराब है।,0
सकी हालत बिगड़ती देख उसे पुरुलिया के रघुनाथपुर सरकार अस्पताल मे भर्ती कराया गया।,0
स वक्त सलमान नशे की हालत में थे और गाडी से उतरते ही जमीन पर गिर गए थे।,0
ारों घायलों की हालत चिंताजनक है।,0
ायलों में एक की हालत चिंताजनक बनी हुई है।,0
रसीए में उनकी वापसी के साथ ही शर्मनाक स्थिति पैदा हो गई थी।,0
ह नहीं समझ सकते कि वह किस बुरे हालात में थी।,0
ीलोखेड़ी और तरावड़ी में कोहरे के हालात जस के तस बने हुए हैं।,0
ालात नहीं बदले तो बैंक कर्मी व अधिकारी लंबे समय तक हड़ताल पर चले जाएंगे.,0
रेलू स्टील उपभोग में कम वृद्धि से यह संकेत मिलता है कि पूरे साल के दौरान बेस लेवल मांग की दशा कमजोर बनी रही।,0
्रामीण स्वास्थ्य सेवाओं की बड़ी बदहाल दशा है।,0
धिकांश हैंडपंप खराब दशा में हैं या तो दूषित जल देते हैं।,0
्यापारियों ने रविंद्र को घायल अवस्था में पड़े देखा तो वह उन्हें लहूलुहान हालत में अस्पताल ले गए।,0
र्मचारियों का कहना है कि उनके लिए बने आवास अब जर्जर अवस्था में है।,0
ृषि ऋण आदि में  लोगों को काफी परेशानी का सामना करना पड़ रहा है।,0
भी मैंने अपने कुछ लक्ष्य हासिल नहीं किये हैं.,0
ंखें बंद करके ध्यान लगाना धर्म नहीं है।,0
ह नहीं चाहती कि उनके बच्चे उन्हें ऐसा करते देखें।,0
"ोकल यात्रियों के लिए स्टेशन पर अनारक्षित टिकट लेने के लिए मात्र दो टिकट खिड़की है, जो यात्रियों के बोझ से कराह रही हैं।",0
"सका भारऔर यह किस चीज से बना है, इस बारे में जानकारी नहीं है।",0
ुझे अपने शरीर पर उसके शरीर का भार महसूस हुआ लेकिन नजर कोई नहीं आ रहा था।,0
ेंद पुरानी पड़ने पर उस पर शॉट मारना आसान नहीं था।,0
नके लिए भी बच्चे को निकालना आसान नहीं था।,0
ूनम का कहना है कि उनका उपनाम उनकी छवि के खिलाफ हो गया।,0
ोनाली को पता होना चाहिए कैसे व्यवहार किया जाता है।,0
ुलजार इतना अभिभूत दिखे कि उन्होंने खुद माना कि इस मौके पर उनसे बोलना मुश्किल हो रहा है।,0
िवेश के आकार को देखते हुए अमेरिका में कामकाज संचालित करने की व्यवस्था का कोई मतलब नहीं बनता।,0
"सके विरोध में मोदी ने ऊपरी अदालत में केस दर्ज कराया, लेकिन उनकी अपील खारिज हो गई।",0
खिलेश ने मोदी की चाय पर चुटकी ली और कहा कि अंग्रेजों ने तो देश को चाय पिलाकर गुलाम बना दिया।,0
ह साल बीत गए हैं पर दर्द अब भी ताज़ा है.,0
"ूवी में इतनी परेशानी नहीं आई, लेकिन प्रमोशन में सब कुछ लाइव करना है, जो ज्यादा मुश्किल है।",0
"ह लाइन लिखने में जितनी सरल है, रजनी का जोनल कैंप मे सेलेक्ट होने तक का सफर उतना ही मुश्किल रहा।",0
ाउंसर बॉल की ने बल्लेबाजों के लिए उन्हें खेलना मुश्किल कर दिया।,0
सके बाद केकेआर के खिलाड़ियों ने तेजी से रन बटोरने के चक्कर में गैरजिम्मेदारी पारी खेलकर टीम को मुश्किल में डाल दिया।,0
सबीआई बैंकों की शाखाओं में काम ढीला रहा।,0
ह मुलाकात फलदायी नहीं रही क्योंकि लतीफ ने दोबारा दोहराया कि वह मुख्य चयनकर्ता बनने में दिलचस्पी नहीं रखते।,0
प्तान रोहित शर्मा टीम संयोजन तय करने में बुरी तरह असफल रहे हैं।,0
ाइट राइडर्स अब तक अपेक्षा के अनुरूप प्रदर्शन करने में असफल रही है.,0
फसोस लेखक और निर्देशक तनुश्री चटर्जी बसु इस पुरानी कहानी को नया अंदाज देने में असफल रही हैं।,0
"ुछ फिल्मों की कहानियां वे लिख चुके हैं, ये बात और है कि उनकी लिखी फिल्में बॉक्स ऑफिस पर बुरी तरह असफल रही हैं।",0
टेस्ट में असफल रहा एथलीट यह पुरस्कार ग्रहण नहीं कर सकता है।,0
सकी कोशिशें हर बार नाकामयाब ही होती हैं।,0
ेकिन दोनों ही ठोस शुरुआत को बड़े स्कोर में बदलने में नाकामयाब रहे।,0
माम दावों के बाद भी सरकार इस बीमारी को रोकने में हर बार नाकामयाब होती है।,0
ंदन में दोनों मेडल स्पर्धाओं के फाइनल में पहुंचने के बावजूद भी वह पदक जीतने में नाकामयाब रही थी।,0
"नके अलावा डेल स्टेन ने कसी हुई बोलिंग करते हुए 4 ओवर में केवल 26 रन दिए, लेकिन वह कोई विकेट झटकने में नाकामयाब  नहीं रहे।",0
सके बाद आखिरी तीन मैचों में वह 30 रन तक तो पहुंचे लेकिन बड़ी पारी खेलने में नाकाम रहे.,0
मता ने सांप्रदायिक पार्टी भाजपा को रोकने में नाकाम होने के लिए कांग्रेस की आलोचना की।,0
न्होंने 2012 में लंदन में हुए ओलंपिक खेलों में वापसी करने की कोशिश की थी लेकिन वह इसमें नाकाम रहे।,0
"नके अलावा यूसुफ पठान ने 41 रनों की तूफानी पारी खेली, लेकिन दोनों ही टीम को जीत दिलाने में नाकाम रहे.",0
ारतीय कप्तान रितु रानी ने मिडफील्ड में कुछ अच्छे मूव बनाए लेकिन विरोधी टीम की रक्षापंक्ति ने उन्हें नाकाम करने में कसर नहीं छोड़ी.,0
ससे पहले वे शून्य की हैट्रिक और एक मैच में एक रन पर आउट हुए थे।,0
ूप छांव का विपरीत असर मूंग की फसल पर पड़ा है।,0
ायरिंग होते ही रवी और कल्लू विपरीत दिशाओं में जान बचाकर भागे।,0
म्मीद के विपरीत दोनों ही ट्रेनों में यात्रियों की संख्या काफी कम रहती है।,0
"ालिका बेशक जेनरेटर से जलापूर्ति देने का दावा कर रही हो, लेकिन हालात इसके विपरीत हैं।",0
ाव ने कहा कि आर्थिक स्लोडाउन और राज्य के हालात की वजह से कारोबार व इंडस्ट्री पर विपरीत प्रभाव पड़ा|,0
गातार विकेट गिरने से रन गति पर प्रतिकूल प्रभाव पड़ा.,0
न्होंने इसके पीछे अमेरिका में प्रतिकूल स्थितियों के कारण स्टोर्स बंद होने का हवाला दिया था।,0
ुरुमूर्ति ने कहा है कि यूपीए सरकार की आर्थिक नीतियों ने अर्थव्यवस्था पर प्रतिकूल प्रभाव डाला है.,0
स संगठन का आरोप है कि फर्जी लाभार्थियों के नाम पर यूपीए सरकार की इस महत्वाकांक्षी योजना के पैसे गबन हो रहा है.,0
