"'चेन्नई एक्सप्रेस' में दीपिका पादुकोण ने संवादों को खास लहजा दिया है , फिल्म में वह कई बार टूटता है",0
पिछले मैच में वे बाहर बैठे थे लेकिन फीरोजशाह कोटला मैदान की धीमी पिच पर वे उपयोगी हो सकते हैं।,1
अंधाधुंधगोलीबारी में चार लोगों की मौत हो गई।,0
जिसमें इस बीमारी के इलाज तथा इसकी प्रक्रिया को भी सत्यापित किया गया।,1
वो खुद लेखक भी हैं तो कई सारी चीज़ों को बेहतरीन तरीके से तार्किक बना देते हैं,1
मुलाकात के बाद दोनों तरफ के जवानों ने वॉलीबॉल का दोस्ताना मैच खेला।,1
अमित साध ने संवाद और भाषा का अभ्यास नहीं किया है,0
तो वहीं बॉलीवुड के दंबग सलमान खान की तरह वो भी काफी अंधविश्वासी हैं।,1
इससे पहले रोहित का टास जीतना और फिर पारी का आगाज करने के लिये उतरना स्वयं उनके लिये अच्छा नहीं रहा।,0
माँ के बेटे जो सीमा पर लिखते हैं अपने शोणित से समझोतों वाली स्याही से दिल्ली वाले धो देते हैं,0
'रुस्तम’ अलग किस्म की थ्रिलर फिल्म है,1
"डिविलियर्स ने पांच छक्कों से सजी 53 रन की पारी खेली, लेकिन वह टीम को आठ मैचों में पांचवीं और पंजाब के खिलाफ दूसरी हार से बचा नहीं सके",0
पटकथा की रवानी में इन पर आम दर्शक का ज्यादा ध्यान नहीं जाता,0
इससे अन्य मुद्राओं के मुकाबले अमरीकी डॉलर मजबूत होगा।,0
नागपुर रोड पर मंगलवार सुबह करीब सवा 11 बजे हुए एक भयानक हादसा हुआ।,0
मेरा दिल जलता नही सुलगता है ऐ-हयात जब तुम मुस्कुराकर किसी और से बात करते हो,0
एडिटिंग भी शार्प है,1
फिल्म की पैकेजिंग और संगीत इसकी जान है।,1
लोगों ने इस कदर गुस्सा था कि उन्होंने पथराव कर पीसीआर का शीशा तोड़ दिया।,0
फिल्म का गीत-संगीत बेहतर है,1
सुजैन मेरे जीवन के लिए मेरा प्यार है और हमेशा रहेगी अगर उसकी मुस्कुराहट मेरे बगैर ज्यादा चमकदार है तो उनके लिए मेरे प्यार को इसे पूरा करना चाहिए।,1
हालांकि इस फोन की बेजल को थोड़ा पतला किया गया है.,0
इंटरवल के बाद फिल्म उलझ जाती है।,0
समय की कमी और इतना मुश्किल काम जल्द करने में असमर्थ रेडक्लिफ़ अपने हाथ खड़े कर देते हैं,0
रॉयल चैलेंजर्स बेंगलूर के खिलाफ बेहतरीन कैच लपकने वाले क्रिस लिन की तारीफों के ट्विटर पर जमकर पुल बांधे जा रहे हैं,1
इस बयान का खंडन किया जा चुका है तथापि खंडन के साथ सहमति बनाने की कांग्रेस की रणनीति से सभी वाकिफ हैं।,1
भाजपा जानबूझकर साम्प्रदायिक रास्ता अपना रही है |,0
"बंपी, बलजीत, ओमकार और ईशिता ने मुंबई और दिल्ली की टिपिकल खूबियों-खामियों को दिलचस्प रंग-रूप प्रदान किए हैं",1
दृश्यों पर संवाद भारी पड़ते हैं और अपना अर्थ खो देते हैं,0
"इसका भारऔर यह किस चीज से बना है, इस बारे में जानकारी नहीं है।",0
फिल्म का आखिरी हिस्सा कमजोर और मुख्य कहानी से अलग है,0
उन्होंने कहा कि बीजेपी हार के डर से बौखलाकर ऐसे आरोप लगा रही है।,0
इनहेलेशन थेरेपी टैबलेट्स और सीरप की अपेक्षा कहीं अधिक प्रभावी है।,1
मेहमानों के न आने से मेरा सारा खाना व्यर्थ हो गया,0
उन्होंने कहा की जाति या समुदाय की राजनीति बेकार है।,0
फिल्म इंडस्ट्री पर बेहिसाब पैसा बरस रहा है।,0
कारण कि ग्रामों में जल स्रोत नहीं है और जिन ग्रामों में जल स्रोत है उनमें से अधिकांश जल स्रोत बंद पड़े हुये है।,0
खबर आग की तरह फैलती जा रही है हलांकि उनके लिए ये कोई नई बात नहीं है।,0
आपको अपने जोखिम लेने की सीमा के बारे में भी उसे बताना चाहिए।,1
वह लट्ठमार बोली बोलता है,0
मोदी के बीसीसीआई से जुड़ते ही उसके रेवेन्यू में जबरदस्त उछाल आया।,1
"लेकिन पृथ्वी पर आने के बाद भूतनाथ को देख लोग डरते नहीं, बल्कि उनका मज़ाक उड़ाने लगत हैं।",0
"स्टार्क ने पोलार्ड के शरीर को निशाना बनाया, जिससे उन्हें गुस्सा आ गया और उन्होंने स्टार्क की ओर बल्ला फेंका।",0
यह फिल्‍म अपने उद्देश्‍य तक नहीं पहुंच पाती,0
कहा कि इससे कागजी प्रक्रिया का बोझ कम होगा।,1
यदि यह ढीला और अलग होता है तो प्लग बिजली के सॉकेट में लगे होने पर करंट लग सकता है।,0
कंपनी के लिए यह पता लगाना संभव नहीं होता कि यह फोन उसके ऑफिस से किस एजेंट ने किया है,0
रष्टाचार और सुशासन महत्वपूर्ण मुद्दे हैं लेकिन देश का धर्मनिरपेक्ष चरित्र मोलभाव करने की चीज नहीं है।,0
अक्षय कुमार का अल्हड़ और बेफिक्र अंदाज मुग्ध करता है,1
इस घटना से व्यापारी का परिवार दहशत में हैं। भय से पुलिस में कोई तहरीर नहीं दी।,0
यह उनके लिए काफी सुखद और बहुत बड़ी बात है।,1
सही समय पर योजित कार्य को सम्पन्न कर देना चाहिए,1
"बगदादी के गढ़ से EXCLUSIVE रिपोर्ट, 39 भारतियों की तलाश। https://t.co/ZPHsj29i5G",1
"मैं फिल्म महोत्सव में जा सकता था, लेकिन मैं इस बात को लेकर आश्वस्त नहीं था कि इसे वह रिलीज मिल रही है या नहीं, जिसके यह काबिल है।",0
"इनमें छह प्रशिक्षणार्थी एएनएम तो ऐसी हैं, जिन्हें स्टाइपेंड के नाम पर अभी तक फूटी कौड़ी तक नहीं दी गई है।",0
आपको इस चीज को हास्य के तौर पर ले लेना चाहिए।,1
हमने कड़ा अभ्यास किया है और कोई भी कसर बाकी नहीं छोड़ी है।,1
रैली से एक दिन पहले नरेंद्र मोदी के सुरक्षाकर्मी की हार्ट अटैक से मौत,0
गंभीर शख्स की भूमिका में वे सहज लगते हैं,1
स्टार्ट टू एंड मिथुन फिल्म में छाए हुए हैं।,1
उत्साही व्यक्ति कोई भी काम उत्साह के साथ करता है,1
लक्ष्य से ठीक 3 रन पहले वाटसन का विकेट युजवेंद्र चहल ने चटकाया.,0
दिल्ली में शिला सरकार ने जो जनता पर बर्बरता से टियर गैस और डंडे बरसाए थे उसके पीछे कहीं वह १४ लाख फर्जी वोट तो प्रेरणा के श्रोत नहीं थे?AAP,0
‘हिंदी मीडियम’ जैसी बेहतरीन फिल्‍म का यह कमजोर अंश है,0
मैं आमिर खान की सरलता और मानवता जैसे गुणों को अपनाना चाहता हूं।,1
जिले में अप्रशिक्षित चिकित्सकों द्वारा चिकित्सा का कार्य कर लोगों के जीवन के साथ खिलवाड़ किये जाने की लगातार शिकायतें मिल रही है।,0
बहुतों ने इस बात का समर्थन किया,1
हिंदी फिल्‍मों के पारंपरिक किरदार ‘दोस्‍त’ को उन्‍होंने अच्‍छी तरह निभाया है,1
डीसी ने कहा कि निस्वार्थ मानवता की सेवा में ऊना जिला रेडक्रास समिति भी अग्रणी भूमिका निभा रही है।,1
"बहरहाल, दिक्कत अत्‍याधिक सरल पटकथा के चलते हो गई है",0
आब्दी ने बीबीसी को फोन पर बताया कि बीसीसीआई का निर्णय एकदम अनुचित है और वह अदालत की शरण में जाएंगे.,0
आपको अपनी टीम को समझना होगा और उसके साथ काम करना होगा।,0
शाहरुख खान से मिलना किसी लाइव वायर को छू देने की तरह है।,1
बुरा लगने के दो कारण है एक तो मैच में हार दूसरा इस मैच की वजह से आज सन्डे की शाम को भी घर पे ही गवा दिया l,0
कुलपति ने बताया कि यथा शीघ्र गंभीर अनियमित भुगतानों की वसूली करने पर सहमति बन गई है।,0
"इन प्रसंगों में शाहिद कपूर ने पापुलर हीरो की तरह जवांमर्दी दिखाई है, लेकिन उनकी कद-काठी और चेहरे का साथ नहीं मिल पाता",0
पोषण पुनर्वास केन्द्र खोलकर कुपोषित बच्चों का उपचार किया जाता है मगर कुपोषण कम होने के बजाय पिछले चार सालों में डबल से अधिक हो गया है।,0
Exclusive interview में @yadavakhilesh ने  @aajtak से कहा कि मायावती से गठबंधन में वो बड़ा त्याग करने को तैयार हैं… https://t.co/OMmjC0FP0x,1
"औचक नमूने टूर्नामेंट की तारीख के करीब ही लिए गये थे, इसलिये उन्हें एक ही उल्लघंन के रूप में लिया गया.",0
उसने भगवान को मानना शुरू कर दिया।,1
गुलजार अपनी खासियत के बावजूद प्रभावित नहीं कर पाते,0
आनंद राय ने बहुत खूबसूरती और सोच से कुंदन के चरित्र को गढ़ा है,1
आयुष्मान खुराना और परिणीति चोपड़ा दोनों में निखार आया है और आत्मविश्वास बढ़ा है,1
कई समाजों द्वारा इस अबूझ मुहूर्त से अधिकाधिक जोड़ों को लाभान्वित करने सामूहिक विवाह सम्मेलनों का आयोजन भी किया जा रहा है।,1
आप अपना बहुमूल्य समय यूँ ही मत गँवाइए,1
@sshubho Lol और दिलचस्प तो यूं है की ईवीएम पर सबसे ज्यादा छाती पीटने वाली बाबु-बुआ की जोड़ी जीत के बाद छाती चौड़ी किए सब भूल चुके हैं।,1
उसकी बात सुनते ही श्याम का चेहरा रुआँसा हो गया,0
निर्देशक रवि उदयवार प्रभावी सीन गढ़ने में खासे सफल रहे हैं,1
कृपा कर आप मेरे सीधे सवालों के सीधे जवाब दीजिए,1
बीजेपी और भक्त ऐसा बर्ताव कर रहे हैं जैसे केजरीवाल के इस्तीफे ने उन्हें हमेशा के लिए संविधान का Rape करने का हक दिया।#FraudBySecretBallot,0
विपुल ने शोर मचाते हुए भागने का प्रयास किया।,0
अपने उपसंहार में यह फिल्म दुविधा की शिकार होती है,0
इंटरवल से पहले इस तरह के कई दृश्य जबरन ठूंसे गए लगते है,0
चोट की वजह से पिछले सीजन में वे खेल नहीं पाए थे और शुरुआती मैचों में भी पीटरसन चोटिल रहने की वजह से नहीं खेल पाए थे।,0
लगता है राम गोपाल वर्मा और उनकी फैक्ट्री के दिन ठीक नहीं चल रहे हैं.,0
दूसरी ओर उड़िया पृष्ठभूमि पर बनी इस फिल्म में ऐसा कोई चालू मसाला मौजूद नहीं है जो दर्शकों को सिनेमाघरों की ओर खींच सके।,0
ग्रामीण स्वास्थ्य सेवाओं की बड़ी बदहाल दशा है।,0
"ये तीनों ऐसी फिल्में हैं, जो कम बजट में बनीं लेकिन इन्होंने ठीकठाक बिजनेस भी किया।",0
"साथ ही, डॉलर के मुकाबले रुपये के कमजोर होने का भी इस पर असर हुआ है।'",0
"द.अफ्रीकी शहर जोहांसबर्ग से समुद्री किनारों से लेकर, गगनचुम्बी बिल्डिगों और वहां के मैदानों की हरी घास को बहुत ही मास्टरी से दिखाया गया है।",1
डायरेक्टर नितेश तिवारी कुछ अनावश्यक सीन दिखाने के बाद कहानी की असल जड़ तक पहुंचते हैं।,0
सहयोगी कलाकारों में रोनित रॉय और रोहित रॉय सगे भाइयों की कास्टिंग जबरदस्त है,1
यह मेरी जिंदगी का सबसे आकर्षक समय है और अगर मेरा बीता समय नहीं होता तो यह नहीं होता।,1
भगवान कृष्ण विदुर के अतिथि-सत्कार से बहुत ही प्रसन्न हुए,1
हिंदी फिल्मों में मनोरंजन की आक्रामक धूप से तिलमिलाए दर्शकों के लिए यह ठंडी छांव और बार की तरह है,1
यहां मेडिकल के लिए डॉक्टरों द्वारा की गई लापरवाही पर समाजजन ने सीएमओ के खिलाफ जमकर आक्रोश दिखाया और नारे भी लगाए।,0
ब्रांडेड आइटम की अपेक्षा लोग देशी कूलर पर ज्यादा भरोसा कर रहे हैं।,1
वह हरदम किसी न किसी मुसीबत का सामना करता दिखाई देता है।,0
"गैलेक्सी S5 मार्च में लॉन्च हुआ था, लेकिन इसकी लोकप्रियता अभी भी बनी हुई है।",1
अपनी भी कहानी गजब हैं सेकुलर लोग साम्प्रदायिक बोलते हैं और कट्टर मुझे सेकुलर बोलते हैं दोनों तरफ से गाली खानी पड़ती हैं,0
निर्धन व्यक्ति कड़ी मेहनत करके धनी हो सकता है,1
करेंट एकाउंट डेफिसिट की हालत में सुधार आ सकता है।,1
राजस्थान के बारा सहित कई शहरों का आवागमन सुगम हो जाएगा।,1
मोदी को देश का प्रधानमंत्री बनाने के लिए इस 'भाग्यशाली' सीट को जीतने के लिए अपनी ओर से पुरजोर कोशिशें की है।,1
नाइजीरिया में हुए हमलों में 150 लोगों की मौत |,0
गुप्ता ने भूमिका के हाथ में रक्षा सूत्र बांध कर एवं तिलक लगाकर उसके संरक्षण का दायित्व लिया।,1
यह मूर्तिकार बहुत अच्छी नक्काशी करता है,1
उनका मानना है कि इस वक्त किसी संबंध में पड़ना चीजों को जटिल बना सकता है.,0
टीम की हार के बाद उन्होंने खुद के अनफिट होने का बहाना फिर से दोहाराया।,0
संयमित कर्म करके मनुष्य अपना जीवन सफल बना सकता है,1
"रिपोर्ट के मुताबिक, अधिकतर इन्वेस्टर्स मोदी की जीत के प्रति भी आश्वस्त नहीं है।",0
"यह फिल्म कहानी, संरचना और प्रस्तुति के स्तर पर लचर और कमजोर है",0
इस मामले की अगली सुनवाई के लिए 17 मई तिथि नियत की गई है।,0
समतल भूमि पर अच्छी खेती होती है,1
भारी बारिश ने फ़िल्म 'क्लिक करें मैरी कॉम' की पूरी टीम को ये दृश्य एक ही दिन में फ़िल्माने के लिए विवश कर दिया.,0
कहानी में कुछ नयापन या खास नहीं,0
इसी दौरान ग्राम भर्रीटोला में अज्ञात 4 आरोपियों ने रास्ता रोका।,0
अपूर्व ने फॉर्मुला फिल्म में भी नयापन का छौंका लगाया है।,1
"पका सुरूर और कर्ज के मुकाबले हिमेश इस बार रोल में जमे है। फिल्म में उनकी एक्टिंग देखकर लगता है रेडियो जॉकी की भूमिका के लिए उन्होंने अच्छी खासी तैयारी की है। आरजे की लाइफ स्टाइल , रेडियो पर अपने शो को हिमेश ने दमदार अंदाज में पेश किया है। सोनल सहगल और शहनाज अपनी भूमिकाओं में ठीकठाक रहीं। छोटी सी भूमिका के बावजूद परेश रावल खूब जमे और हंसाने में कामयाब रहे।",1
