निर्माण कार्य होने के चलते इन भागों की भी खुदाई चोरी-छिपे होने लगी हैं।,0
इन दोनों फिल्मों में अपने अभिनय से सराहना पा रहीं 27 वर्षीय कंगना ने कहा कि यह भ्रांति है कि हीरोइनों को पर्दे पर सुंदर दिखना चाहिए।,1
मैं परिवार का निरादर करके जानकारी का खुलासा नहीं करना चाहती।,1
"भारत सरकार भले ही कोई ठोस कार्रवाई न कर रही हो, लेकिन पड़ोसी देश पाकिस्तान इस मामले में तेजी से कदम बढ़ा रहा है।",1
हम उनके कठिन परिश्रम और काम के प्रति लगन के लिए आभारी हैं।,1
मगर इतने पर भी पुलिस न तो वारदातों पर लगाम लगा सकी और नहीं हाल ही में हुई वारदातों का खुलासा कर सकी।,0
छत्तीसगढ़ राज्य विद्युत उत्पादन कंपनी के लक्ष्य में 4357 मिनियन यूनिट बिजली उत्पादन की बढ़ोतरी की गई है।,1
दर्शन कुमार उनका साथ देने में कहीं-कहीं पिछड़ जाते हैं,0
जेएसपीएल के चेयरमैन नवीन जिंदल ने कहा कि रायगढ़ संयंत्र में हमने काम का एक उच्च स्तर बनाकर रखा है।,1
"Exclusive: अब मोटरसाइकिल से भी आ रहे चीन के सैनिक, बाराहोती में 5 बार की घुसपैठhttps://t.co/2tG8fxqFUgएक वार्ता के… https://t.co/7wInVG7Bh6",1
तो फिर फेंक अाई डी क्यों बनाई है गर्व के साथ अापना नाम लेने में शर्म कैसी क्या सिर्फ गालियां देने के लिये,0
साफ लगता है कि बोल्‍डनेस की चाह रखने वालों का खास ख्‍याल रखा गया है,0
"इरशाद कामिल और विशाल-शेखर के गीत-संगीत में फिल्म की थीम, किरदारों के इमोशन और पॉपुलर जरूरतों पर समान रूप से ध्यान दिया गया",1
औद्योगिक नगरी सूरत में एक और कपड़ा मार्केट में शनिवार को भीषण आग लग गई।,0
तमाम दावों के बाद भी सरकार इस बीमारी को रोकने में हर बार नाकामयाब होती है।,0
मैं नियोजित समय पर आप से मिलूँगा,1
"अहंकार दौलत का हो, ताकत का हो, जमीन जायदाद का हो किसी भी हाल में पतन निश्चित है।",0
सलमान के खिलाफ लापरवाही से वाहन चलाने और अन्य आरोपों को लेकर मामला दर्ज किया था.,0
"इंडस्ट्री में ऐसे कम ही लोग मिलेंगे , जो अपनी पूरी हो चुकी फिल्म को सिर्फ एक स्टार की वजह से डिब्बे में बंद कर देते हैं।",0
वहीं सुहैल खान और जैकी ने निराश किया।,0
इस परीक्षा में 1052 परीक्षार्थी अनुपस्थित रहे।,0
इस दौरान सूचना के बाद आवेदक अनुपस्थित भी नहीं था।,0
नियम उसे खातों की प्राथमिक जांच के आगे जाने के लिए बाध्य नहीं कर सकते हैं।,1
"यह छूट बेस किराए के अलावा अन्य टैक्स या फिर चार्जेज पर लागू नहीं होगी, यानी वे सभी शुल्क ज्यों के त्यों मुसाफिर को देने होंगे।",0
~चप्पड़गंजू नसीहत दे रहा है की गुरु का सम्मान करें।और खुद के TL par Har Har,0
फिल्म पर आपत्तिजनक दृश्य दिखाने व धार्मिक भावनाओं को ठेस पहुंचाने का आरोप है।,0
एक सेल्समैन के इर्दगिर्द घूमती इस स्क्रिप्ट में एंटरटेनमेंट और बॉक्स ऑफिस पर बिकाऊ कोई मसाला नहीं है। ऐसा लगता है स्क्रिप्ट राइटर भी फिल्म के क्लाइमेक्स को फाइनल करने में कुछ कन्फ्यूज रहा तभी आखिरी बीस मिनट की कहानी बेवजह आगे खिसकाई गई लगती है।,0
ओर आस्ट्ॆलिया वाले फाँकनर को इज्जत नही देते इसी लिए फाकनर भी इंग्लैंड के लिए खेलने लगा है ।,0
अगर वे बातें कर रहे हों तो हर मामले को रोशन कर देते हैं।,1
फिरौती के लिए अपहरण किया गया बालक सकुशल बरामद हो गया है।,1
"रेडक्रास सोसायटी के अध्यक्ष यद्यपि कलेक्टर हैं, किन्तु वह व्यस्त होने के कारण इस कार्यक्रम में उपस्थित नहीं हो सके।",0
नीरज जी को साक्षात् सुनने का अलग आनंद है,1
पिछली कई फिल्मों में स्क्रीन पर दूल्हा बन रहे फरदीन भी पूरी फिल्म में बुझे - बुझे नजर आते हैं।,0
अब मुझे इस बात का अफसोस होता है कि मैंने ऐसा क्यों नहीं किया।,0
उन्होंने कहा कि यह अदालत की अवमानना थी अतएव वे दोबारा अदालत की शरण में गए हैं।,0
अनेक प्रतिभाओं के योगदान के बावजूद गीत-संगीत मामूली है,0
केजरीवाल वो लौंडा है जो KBC में जा कर पहला ही सवाल का गलत जवाब देगा और उसे कुर्सी से उतरने को कहने पर BigB के खिलाफ ही धरने पे बैठ जाएगा,0
हमशकल्स में सैफ न केवल गुजराती बोलते नजर आएंगे बल्कि अपने किरदार में हास्य का तड़का भी लगाते नजर आएंगे.,1
जम्मू कश्मीर के मित्रों द्वारा तस्वीर भेजी गई हैं वहाँ की हालत दयनीय है।। इस स्थिति के लिए स्वयं मनुष्य,0
सिफारिशों एवं घोषणाओं पर गंभीरतापूर्वक कार्य किया जाए,1
सोनिया का कमाल देखो देश का हाल देखो भारत देश वन गया भूटान इटली वन गयी अमेरिकन यदि देश इसी तरह रहेगा तो भारत एक दिन गुलाम होगा,0
Female IAS officer molestation दिल्लीः साकेत कोर्ट परिसर में महिला IAS अधिकारी से छेड़छाड़ https://t.co/MtZhnAfYiV,0
"िंडारी, अंग्रेज, उन्नीसवीं सदी का भारत कुछ भी तो फिल्म में ढंग से रेखांकित नहीं हो पाया है।",0
आयोजन स्थल में बदलाव की वजह से भारत में क्रिकेट के दीवाने स्टेडियम में आईपीएल मैच देखने से महरूम रह जाएंगे,0
"ुछ यही हाल इस फिल्म में भी है गाने अच्छे और कर्णप्रिय है , लेकिन स्क्रिप्ट में उनके लिए गुंजाइश नहीं थी , सो चम चम चांद सा चेहरा , यादें याद आती है , मेरी जान जाती है जैसे अच्छे गाने भी असर नहीं छोड़ पाते।",0
इसके बाद से लगातार विवादास्पद घटनाओं के चलते कद्दावर क्रिकेट प्रशासक मोदी का पतन शुरू हो गया।,0
दर्शकों को रिझाने या बहलाने के लिए इस फिल्म में कुछ भी नहीं है,0
कहानी बड़ी होशियारी से अपनी अपील को बच्चों के मिजाज से उड़ान भरते हुए युवा व परिपक्‍व सोच-अप्रोच का विस्तार प्रदान करती है,1
नशे में चूर बाबा घर लौटते हुए।शुभरात्रि।,0
आस्ट्रेलियाई टीम जहां खिताबी हैट्रिक के लिए प्रयास करेगी वहीं इंग्लिश टीम दोबारा इस खिताब पर कब्जा जमाना चाहेगी.,1
मुंबई इंडियंस की टीम इस समय उन सभी दिक्कतों का सामना कर रही है जिनसे कोई भी टीम बचना चाहती है।,1
फिल्म का गीत-संगीत नया और विषय के अनुकूल है,1
"उधर सामने वाला बेवकूफ समझ तरह-तरह के स्वांग भर हमारा ध्यान रोज-रोज के दुख, दर्द, मंहगाई, कठिनाई, नून, तेल लकड़ी{गैस}से हटा अपने तरीके से प्रभावित करने के लिये ही तमाशा करता रहता है।",0
सेट और कॉस्ट्यूम में कल्पना और बजट की कटौती से फिल्म का प्रभाव कम हुआ है,0
जिला अस्पताल में रोजाना 80 से 90 संक्रामक रोगी आ रहे हैं।,0
अगर आपने फिल्म में तर्क या कुछ नया तलाशने की कोशिश की तो हॉल में वक्त काटना मुश्किल है।,0
कई देशों के सफर के बाद स्विटजरलैंड की नताली को आखिरकार भारत में सच्‍चा प्‍यार मिल ही गया।,1
निस्वार्थ भाव से किया गया कर्म सदैव सुखदायक होता है।,1
भूतनाथ के कठिन प्रयास और हर थोड़ी देर में बोमन का राजनीतिक ढोंग जो अपने दुश्मन को नीचा दिखाने में कभी पीछे नहीं हटता।,0
फिल्म संगीत कहानी की लय में चार चांद लगाता है,1
इस लुक को आकर्षक बनाने के लिए कम्पनी ज्यादा चौड़े हैडलाइट्स लगाने की सोच रही है।,1
इसी का तो खौफ है। पहले इन्होंने Iraq और Syria मे लोगों को शिया-सुन्नी-कुर्द-अलावाई-अरबी-फार्सी और कबीलाओं में बाँटा।,0
असहिष्णु लोगों को कोई पसंद नहीं करता है,0
ताजमहल कुशल शिल्पियों की एक अनुपम कृति है,1
फिल्‍म अपना संदेश कह जाती है,1
मिथुन चक्रवर्ती और पुरू राज कुमार अपनी भूमिकाओं से प्रभावित करते हैं।,1
तारे बिलकुल भी लय में नहीं दिख रहे थे.,0
राहुल - वरुण के संवादों में ऐसा दम नहीं कि दर्शकों को बांध सकें।,0
विश्व का सबसे अधिवासित दक्षिणतम नगर है,1
जिसके कारण समस्या जस की तस बनी हुई है।,0
यह वेध्य दुर्ग है,1
यह पूर्णता की प्रतीक है।,1
शिक्षा विभाग सरकारी स्कूलों में क्वालिटी एजुकेशन देने के मामले में फिसड्डी निकला।,0
तारे बिलकुल भी लय में नहीं दिख रहे थे.,1
आदित्य अपने परिवार के संग खुशी पूर्वक जिंदगी गुजारते है।,1
"यकीनन फरहान ने इस बार फिर साबित किया कि उनके अंदर भूमिका को जीवंत करने का जज्बा है। कार्तिक के करैक्टर को फरहान ने दो बिल्कुल अलग लुक में पेश किया है। फिल्म की शुरुआत में चश्मा पहने हुए , बॉस की डांट खाने वाले और बाद में बॉस के केबिन में जाकर बॉस से मनचाही टर्म्स मनवाने वाले कार्तिक के रूप में फरहान खूब जमे हैं। पिछली फिल्मों के मुकाबले दीपिका इस फिल्म में बिल्कुल अलग और फ्रेश लुक में नजर आईं।",1
"@KumarKunalmedia फिल्म का नाम ""56 इंच का सीना"" :-p",1
इसके अलावा व्यक्तिगत जवाबदेही से भी काफी अंतर पड़ा है।,1
"उनमें संभावनाएं जरूर हैं मगर, उनके लॉन्चिंग में जल्दीबाजी की गई है",0
दिल्ली को अभी तक छह मुकाबलों में से चार में शिकस्त का मुंह देखना पड़ा है।,0
रिलायंस कंपनी के कारण उनका आर्थिक और मानसिक उत्पीडन हुआ है,0
निजी मकान की इच्छा पूर्ति के अवसर मिलेंगे।,1
"बिजली व्यवस्था चरमराती है, तो पेयजल आपूर्ति पर भी असर पड़ता है।",0
तीनों किरदारों को अच्छी तरह गढ़ा गया है,1
"मार्ग पर लोगों की आवाजाही कम रही, अन्यथा बड़ा हादसा हो सकता था।",0
जहीर की ट्रिपल सेंचुरी से धोनी ब्रिगेड ने टाला दुर्भाग्यशाली रिकॉर्ड,1
मरीज की हालत नाजुक बनी हुई है।,0
आपके लेख की कोई संरचना ही नहीं है,0
"यह उस कसौटी पर तमाम कलाकारों, फिल्मकार और फिल्म से जुड़े हर विभाग के लोगों के अथक प्रयास से पूर्णत: खरी उतरी",1
मूल कथा और रईस के मिजाज के लिए जरूरी होने के बावजूद जोड़ा गया लगता है,0
आईटी नेटवर्क मजबूत किए बिना जीएसटी असंभव है।',0
श्रीनिवासन को सुप्रीम कोर्ट की आईपीएल सट्टेबाजी और स्पॉट फिक्सिंग की मौजूदा जांच की वजह से अपने पद से हटने को बाध्य होना पड़ा है।,0
‘दो लफ्जों की कहानी’ ऐसी ही घिसी-पिटी पटकथा पर पसरी फिल्म है,0
शेन वार्न से हर्ले को प्यार अब भी है,1
यही इस फ़िल्म की सबसे बड़ी कमी है,0
एक अजीब सी दौड़ है ये ज़िन्दगी जीत जाओ तो कई अपने पीछे छूट जाते हैं और हार जाओ तो अपने ही पीछे छोड़ जाते हैं।.,0
भारतीय फिल्‍मों का अावश्‍यक तत्व है इमोशन... इस फिल्‍म में इमोशन की कमी है,0
इनमें एक सैकड़ा से अधिक परीक्षार्थी अपने फोटो पहचान पत्र न ला पाने के कारण परीक्षा से वंचित रह गए।,0
पश्चिमी अफ्रीकी देशों मेंइबोला से मरने वालों की संख्या 2 हजार हुई 4हजार लोग हुए इसबीमारी का शिकारः,0
बेवजह धर्म नहीं बना क्रिकेट। धर्म का एक बड़ा काम है वहमों को मान्यता दिलाना और इसी वजह से आजकल इस धर्म का गलत फायदा उठाने में लगे हैं कुछ,0
राय का कहना है कि राजधानी में तापमान बढ़ रहा है और वह जेल में स्वस्थ महसूस नहीं कर रहे हैं।,0
सधे निर्देशक के हाथों हमेशा कलाकार निखर जाते हैं।,1
प्रभु प्राप्ति का सरल मार्ग भक्ति है,1
वह हमेशा साहसिक काम ही करता है,1
कोई पूछता ही नहीं हैं की क्या क्या जला हैं इसराख में लोग बस इतना जानना चाहते हैं की येआग किसने लगायी हैं.,0
किसी को चाहो तो इस अंदाज़ से चाहो कि वो तुम्हे मिले या ना मिलेमगर उसे जब भी प्यार मिलेतो तुम याद आओ,0
टाटा मोटर्स ने कहा कि नया मोवस बडे परिवारों के लिए आदर्श है।,1
उन्हें भारतीय क्रिकेट के अहित की तनिक भी चिंता नहीं है।,0
मोहन का जीवन शांत है,1
नीतीश राजनीति में कठिन दौर से गुजर रहे है।,0
उसकी रोनी सूरत देखकर मुझे दया आ गई,0
जांबाज पिंडारी योद्धा के रोल में सलमान खूब खूब जमे हैं,1
दोनों में दोस्ताना माहौल लग रहा है इसलिए इन्हें रात भर के लिए बाड़े में छोड़ दिया जाए।,1
इसके पहले मंगलवार को रक्षामंत्रालय ने एथारिटी को चैनल के विरूद्ध कार्रवाई के लिए लिखा।,0
"उनके मैदान में उतरने से शरद ही नहीं, मुख्यमंत्री नीतीश कुमार भी आहत हैं।",0
ओपनर मुरली विजय भी ठीकठाक ब्ललेबाजी कर रहे हैं।,0
मौत शायद इसी को कहते हैं दिल अब ख्वाहिशें नहीं करता,0
जबकि मार्ग पर भीड़ लग जाने से आवागमन बंद हो गया।,0
भागते हुए डकैतों ने सुनील अग्रवाल व अजय अग्रवाल के पेट में चाकू मारकर घायल कर दिया था।,0
अदाकारी के लिहाज से पिया बाजपेयी ने जूलिएट के किरदार को बखूबी पर्दे पर पेश किया,1
मुंबई को बड़े स्कोर तक पहुंचाने की जिम्मेदारी इसके बाद कप्तान रोहित और पोलर्ड के कंधे पर थी,1
रामू ने कहानी की रफ्तार कहीं थमने नहीं दी।,1
गौरतलब है कि हाल ही में आयुष ने अपनी और अर्पिता की साथ में एक फोटो पोस्ट की थी और लिखा था कि 'जब अर्पिता के साथ होता हूं तब एक भी लम्हा बेकार नहीं होता,1
क्षेत्र के अधिकांश कृषक सहकारी संस्थाओं के माध्यम से ऋण लेकर खेती किसानी करते है।,0
आंकड़ों ने निराश किया है लेकिन मई में इसमें सुधार मुमकिन है।,1
नाराज परीक्षार्थी हंगामा करने लगे।,0
उनका चित्रण बहुत ही फॉल्स है,0
